Pokemon TCG: V Box HISUIAN ELECTRODE,https://czteryszuflady.pl/sklep/pokemon-tcg/zestawy/pokemon-tcg-v-box-hisuian-electrode/,"76,95 zł"
Pokemon TCG: Silver Tempest 3-Pack Blister Manaphy,https://czteryszuflady.pl/sklep/pokemon-tcg/boostery/pokemon-tcg-silver-tempest-3-pack-blister-manaphy/,"52,95 zł"
Pokemon TCG: Silver Tempest 3-Pack Blister Togetic,https://czteryszuflady.pl/sklep/pokemon-tcg/boostery/pokemon-tcg-silver-tempest-3-pack-blister-togetic/,"52,95 zł"
Pokémon TCG: gotowy zestaw 60 losowych kart + akcesoria,https://czteryszuflady.pl/sklep/pokemon-tcg/zestawy/pokemon-tcg-professor-juniper-akcesoria/,"49,95 zł"
Pokemon TCG: Crown Zenith V box Regieleki,https://czteryszuflady.pl/sklep/wszystko/pokemon-tcg-crown-zenith-v-box-regieleki/,"99,95 zł"
Pokemon TCG: Crown Zenith V box Regidrago,https://czteryszuflady.pl/sklep/pokemon-tcg/zestawy/pokemon-tcg-crown-zenith-v-box-regidrago/,"99,95 zł"
Pokemon TCG: V Box Boltund (OUTLET),https://czteryszuflady.pl/sklep/wszystko/pokemon-tcg-v-box-boltund-outlet/,"94,95 zł"
Pokemon TCG: Paldea Pin Box Fuecoco,https://czteryszuflady.pl/sklep/wszystko/pokemon-tcg-paldea-pin-box-fuecoco/,"99,95 zł"
Pokemon TCG: Paldea Pin Box Quaxly,https://czteryszuflady.pl/sklep/wszystko/pokemon-tcg-paldea-pin-box-quaxly/,"99,95 zł"
Pokemon TCG: Silver Tempest Booster Box,https://czteryszuflady.pl/sklep/pokemon-tcg/boostery/pokemon-tcg-silver-tempest-booster-box/,"646,20 zł"
Pokemon TCG: Silver Tempest Booster,https://czteryszuflady.pl/sklep/pokemon-tcg/boostery/pokemon-tcg-silver-tempest-booster/,"19,95 zł"
Pokemon TCG: Silver Tempest Build & Battle Stadium,https://czteryszuflady.pl/sklep/pokemon-tcg/zestawy/pokemon-tcg-silver-tempest-build-battle-stadium/,"279,95 zł"
Pokémon TCG: Silver Tempest Elite Trainer Box,https://czteryszuflady.pl/sklep/pokemon-tcg/zestawy/pokemon-tcg-silver-tempest-elite-trainer-box/,"189,95 zł"
Pokemon TCG: Silver Tempest Mini Portfolio&Booster,https://czteryszuflady.pl/sklep/pokemon-tcg/akcesoria-pokemon-tcg/pokemon-tcg-silver-tempest-mini-portfoliobooster/,"26,95 zł"
Pokémon TCG: Silver Tempest Premium Checklane Blister Gallade,https://czteryszuflady.pl/sklep/pokemon-tcg/boostery/pokemon-tcg-silver-tempest-premium-gallade/,"27,95 zł"
Pokémon TCG: Silver Tempest Premium Checklane Blister Magnezone,https://czteryszuflady.pl/sklep/pokemon-tcg/boostery/pokemon-tcg-silver-tempest-premium-magnezone/,"27,95 zł"
Pokémon TCG: Silver Tempest Checklane Blister Basculin,https://czteryszuflady.pl/sklep/pokemon-tcg/boostery/pokemon-tcg-silver-tempest-blister-basculin/,"22,95 zł"
Pokémon TCG: Silver Tempest Checklane Blister Cranidos,https://czteryszuflady.pl/sklep/pokemon-tcg/boostery/pokemon-tcg-silver-tempest-blister-cranidos/,"22,95 zł"
Pokemon TCG Energy Cards (121 szt),https://czteryszuflady.pl/sklep/wszystko/pokemon-tcg-energy-cards-121-szt/,"59,95 zł"
Pokemon TCG: Lost Origin – Mini Portfolio,https://czteryszuflady.pl/sklep/pokemon-tcg/akcesoria-pokemon-tcg/pokemon-tcg-lost-origin-mini-portfolio/,"21,95 zł"
Pokemon TCG: Premium Collection Palkia,https://czteryszuflady.pl/sklep/pokemon-tcg/zestawy/pokemon-tcg-premium-collection-palkia/,"164,95 zł"
Pokemon TCG: Premium Collection Dialga,https://czteryszuflady.pl/sklep/pokemon-tcg/zestawy/pokemon-tcg-premium-collection-dialga/,"164,95 zł"
Pokémon TCG: Pokémon Go – Team Special Pin Collection Team Instinct (Spark),https://czteryszuflady.pl/sklep/pokemon-tcg/zestawy/pokemon-tcg-team-special-pin-collection-spark/,"143,95 zł"
Pokémon TCG: Pokémon Go – Team Special Pin Collection Team Mystic (Blanche),https://czteryszuflady.pl/sklep/pokemon-tcg/zestawy/pokemon-tcg-team-special-pin-collection-blanche/,"143,95 zł"
Pokemon TCG: Pokemon GO – booster,https://czteryszuflady.pl/sklep/wszystko/pokemon-tcg-pokemon-go-booster/,"15,95 zł"
Pokemon TCG: Vstar Premium Pin Collection Kleavor,https://czteryszuflady.pl/sklep/pokemon-tcg/zestawy/pokemon-tcg-vstar-premium-pin-collection-kleavor/,"164,95 zł"
Pokémon TCG: Lost Origin – Premium Checklane Blister Torterra,https://czteryszuflady.pl/sklep/pokemon-tcg/zestawy/pokemon-tcg-premium-checklane-blister-torterra/,"27,95 zł"
Pokémon TCG: Lost Origin – Premium Checklane Blister Infernape,https://czteryszuflady.pl/sklep/pokemon-tcg/zestawy/pokemon-tcg-premium-checklane-blister-infernape/,"27,95 zł"
Pokémon TCG: Lost Origin – Checklane Blister Croagunk,https://czteryszuflady.pl/sklep/pokemon-tcg/zestawy/pokemon-tcg-checklane-blister-croagunk/,"22,95 zł"
Pokémon TCG: Lost Origin – 3-Pack Blister Regigigas,https://czteryszuflady.pl/sklep/pokemon-tcg/zestawy/pokemon-tcg-3-pack-blister-regigigas/,"59,95 zł"
Pokemon TCG: Lost Origin – Booster,https://czteryszuflady.pl/sklep/pokemon-tcg/boostery/pokemon-tcg-lost-origin-booster/,"19,95 zł"
Pokemon TCG: Ultra Premium Collection Charizard,https://czteryszuflady.pl/sklep/pokemon-tcg/zestawy/pokemon-tcg-ultra-premium-collection-charizard/,"699,95 zł"
